{
  "$schema": "https://json-schema.org/draft/2020-12/schema",
  "$id": "https://promptsyntax.org/conformance/profile/0.1-draft",
  "title": "PromptSyntax conformance profile",
  "type": "object",
  "additionalProperties": false,
  "required": [
    "format_version",
    "id",
    "version",
    "status",
    "claim",
    "spec",
    "tier",
    "coverage",
    "decisions",
    "requirements"
  ],
  "properties": {
    "format_version": { "const": "0.1-draft" },
    "id": { "type": "string", "pattern": "^[a-z0-9][a-z0-9-]+$" },
    "version": { "type": "string", "minLength": 1 },
    "status": { "enum": ["candidate", "released"] },
    "claim": { "type": "string", "minLength": 1 },
    "spec": {
      "type": "object",
      "additionalProperties": false,
      "required": ["path", "commit", "declared_version", "baseline_status"],
      "properties": {
        "path": { "type": "string", "minLength": 1 },
        "commit": { "type": "string", "pattern": "^[0-9a-f]{40}$" },
        "declared_version": { "type": "string", "minLength": 1 },
        "baseline_status": { "enum": ["working-draft", "frozen"] }
      }
    },
    "tier": { "enum": ["user", "developer", "operator", "oversight"] },
    "coverage": {
      "type": "object",
      "additionalProperties": false,
      "required": ["routing", "assembly", "standing_authoring_surfaces", "oversight"],
      "properties": {
        "routing": { "const": "complete" },
        "assembly": { "enum": ["user-initiated-only", "complete"] },
        "standing_authoring_surfaces": { "enum": ["excluded", "included"] },
        "oversight": { "enum": ["excluded", "informative", "included"] }
      }
    },
    "decisions": {
      "type": "object",
      "additionalProperties": false,
      "required": [
        "exact_entity_policy",
        "substitution_policy",
        "substitution_authority",
        "unknown_fields",
        "request_encoding",
        "unicode_normalization",
        "line_endings"
      ],
      "properties": {
        "exact_entity_policy": { "const": "strict-kept-or-refused" },
        "substitution_policy": { "const": "explicit-best-effort-only" },
        "substitution_authority": { "const": "venue-operations" },
        "unknown_fields": { "const": "reject-except-namespaced-extensions" },
        "request_encoding": { "const": "utf-8" },
        "unicode_normalization": { "const": "none" },
        "line_endings": { "const": "preserve" }
      }
    },
    "requirements": {
      "type": "array",
      "minItems": 1,
      "uniqueItems": true,
      "items": { "type": "string", "pattern": "^PS-[A-Z0-9-]+$" }
    }
  }
}
